NodeName,Title,Description,ContactName,EmailAddress,ImageFileName,ExternalURL,InternalURL,ExternalOnePage,EmailSubject,HTMLResult,PublicPreview,GeneralAvailability,BusinessValue,FeatureDetails
Resource work hours extensibility,Resource work hours extensibility,null,,,,,,https://docs.microsoft.com/en-us/dynamics365-release-plan/2021wave2/service/dynamics365-field-service/resource-work-hours-extensibility,,,-,Oct 2021,Many customers choose to create custom applications to manage work hours calendars. Having a programmatic way to create and update work hours calendars will make it easier to include these capabilities in their experiences. Additionally it will also let customers and partners build integrations with applications such as Dynamics 365 Finance and Supply Chain Management and maintain the same work hours for their resources across multiple different systems.Feature details,With the new resource work hours extensibility you can use APIs to:Update a resource's work hours. For example a resource works 9 AM to 5 PM Monday through Friday; these hours can be changed to 10 AM to 4 PM with a 1-hour of break at 1 PM on only Mondays and Wednesdays.Delete a resource's work hours. For example a resource has a day off planned for next Monday but as the resource's plan change they can delete the time off.NoteThis feature is available in Unified Interface only.Thank you for your ideaThank you for submitting this idea. We listened to your idea along with comments and votes to help us decide what to add to our product roadmap.
Improved user experience with new schedule board enhancements,Improved user experience with new schedule board enhancements,null,,,,,,https://docs.microsoft.com/en-us/dynamics365-release-plan/2021wave2/service/dynamics365-field-service/improved-user-experience-new-schedule-board-enhancements,,,-,Oct 2021,The schedule board is a core piece of functionality for service managers and dispatchers. In 2021 release wave 2 we're adding remaining features to the new schedule board to bring feature parity between the old and new schedule boards so that customers can switch to the new board and experience enhanced productivity through a better user experience.Feature details,We are bringing the following capabilities to the new schedule board:Find availability functionality for finding the best available resources to schedule jobs which could last from a few minutes to as much as a few months. Single resources (such as accounts contacts users and equipment) or multiple resources (such as crews pools and facilities) can be scheduled to jobs.Make the settings available on the schedule board tab so users can create and configure their tabs and don't need to switch back to the old schedule board.Custom fields on a work order or requirement can be displayed as a filter on the schedule board and can also be considered while finding the best available resource via custom attributes by using the Universal fetchXML queries.Custom fields on the work order or requirement can be displayed on the booking information or booking alerts that are displayed on hourly view of the new schedule board.Customers can use custom JavaScript methods that can be executed prior to creation or update of the bookable resource booking records on the hourly view of the new schedule board.The schedule board functionality in hourly view can be extended via different client-side extensions such as scripts stylesheets and localization.See alsoExperience the new and improved schedule board in Dynamics 365 Field Service (docs)
Finance and Operations,Finance and Operations,Finance and Operations,,,,,,https://docs.microsoft.com/en-us/dynamics365-release-plan/2021wave2/,,,,,,
Dynamics 365 Finance,Dynamics 365 Finance,Dynamics 365 Finance,,,,,,https://docs.microsoft.com/en-us/dynamics365-release-plan/2021wave2/finance-operations/dynamics365-finance/,,,,,,
Core financials,Core financials,Core financials,,,,,,https://docs.microsoft.com/en-us/dynamics365-release-plan/2021wave2/finance-operations/dynamics365-finance/planned-features,,,,,,
Prevent posting depreciation to the same period twice,Prevent posting depreciation to the same period twice,null,,,,,,https://docs.microsoft.com/en-us/dynamics365-release-plan/2021wave2/finance-operations/dynamics365-finance/prevent-posting-depreciation-same-period-twice,,,-,Oct 2021,This feature lets you prevent depreciation from being posted to a period that depreciation has already been posted to.Feature details,This feature will validate depreciation transactions during posting. The posting process will be stopped if depreciation for the same asset has already been posted for the same period. A message will alert you to that fact and include the asset ID and book ID.
Display lease ID on fixed asset record,Display lease ID on fixed asset record,null,,,,,,https://docs.microsoft.com/en-us/dynamics365-release-plan/2021wave2/finance-operations/dynamics365-finance/display-lease-id-fixed-asset-record,,,Aug 2021,Oct 2021,By updating the asset record in Fixed assets from a transaction in Asset leasing this feature saves data entry time and helps reduce the possibility of errors by syncing information automatically.Feature details,This enhancement automatically synchronizes asset IDs in Fixed assets and Asset leasing for fixed assets that were acquired using the initial recognition transaction in Asset leasing. The lease description and lease book are also entered in Fixed assets.
Pass service life from Asset leasing to Fixed assets,Pass service life from Asset leasing to Fixed assets,null,,,,,,https://docs.microsoft.com/en-us/dynamics365-release-plan/2021wave2/finance-operations/dynamics365-finance/pass-service-life-asset-leasing-fixed-assets,,,Aug 2021,Oct 2021,By updating the service life of a leased asset in Fixed assets this feature helps you maintain compliance with current accounting standards. This feature automates the process of passing service life from asset leasing to an asset book.Feature details,This enhancement allows the service life of an asset to be added automatically to the asset book in Fixed assets. The service life information is taken from the lease term or the asset useful life whichever is less in Asset leasing. This feature must be enabled in the Feature management workspace.
Create collections activities based on payment predictions,Create collections activities based on payment predictions,null,,,,,,https://docs.microsoft.com/en-us/dynamics365-release-plan/2021wave2/finance-operations/dynamics365-finance/create-collections-activities-based-payment-predictions,,,Aug 2021,Oct 2021,Collections process automation can save time by setting up a consistent strategy for your collection process. Customer payment predictions can predict when customers are likely to pay an invoice late. By combining both features you have one more automated tool to reduce the amount of time spent researching customer invoices and determining collection activities that will help your business get paid faster.Feature details,Customer payment predictions predicts the likelihood that a customer invoice will be paid on time late or very late by assigning a percentage to each invoice. If you know the likelihood of an invoice being paid late the Collections process automation feature can create collections activities for those invoices. You can also set up a threshold or benchmark percentage. Setting a benchmark helps ensure that collections activities are created only for the invoices where the predicted percentage of being paid late is greater than the percentage you set.
Edit Asset leasing journals,Edit Asset leasing journals,null,,,,,,https://docs.microsoft.com/en-us/dynamics365-release-plan/2021wave2/finance-operations/dynamics365-finance/edit-asset-leasing-journals,,,-,Nov 2021,This feature makes it easier to capture vendor invoices on lease payment transactions while also providing flexibility to edit certain fields on an Asset leasing journal before posting. The feature also helps maintain accuracy by not allowing you to edit other fields such as account.Feature details,This feature lets you edit specific fields in Asset leasing journals. You can edit invoice number invoice date description sales tax group and item sales tax group. Other fields including account amount and financial dimensions cant be edited.
Invoice automation – apply prepayments to vendor invoices automatically,Invoice automation – apply prepayments to vendor invoices automatically,null,,,,,,https://docs.microsoft.com/en-us/dynamics365-release-plan/2021wave2/finance-operations/dynamics365-finance/invoice-automation-apply-prepayments-vendor-invoices-automatically,,,-,Nov 2021,This feature saves effort by your accounting staff and can help reduce errors that can occur when processing information manually.Feature details,New parameters have been added in Account payable to let the system apply prepayments to vendor invoices automatically.If this feature isnt enabled and a purchase order is created based on a purchase agreement an accounts payable clerk must apply a prepayment to the resulting invoice manually before that invoice can be settled.When you import vendor invoices with this feature turned on and theres a prepayment on the purchase order the prepayment will be applied to the corresponding vendor invoice automatically.
Prevent automatic one-voucher usage in fixed assets,Prevent automatic one-voucher usage in fixed assets,null,,,,,,https://docs.microsoft.com/en-us/dynamics365-release-plan/2021wave2/finance-operations/dynamics365-finance/prevent-automatic-one-voucher-usage-fixed-assets,,,-,Nov 2021,This feature helps ensure that fixed assets don't require or enable multiple transactions in the same voucher in the general ledger. Adding this restriction helps avoid downstream issues that can result when multiple transactions are included on a single voucher.Feature details,Preventing the automatic use of one-voucher functionality in fixed assets helps ensure that fixed-asset transactions won't use the same voucher number for depreciation adjustments when splitting or disposing of an asset or when recording catch-up depreciation. This also applies to acquisition adjustment transactions when a fixed asset is split.
1099 report revisions for 2021,1099 report revisions for 2021,null,,,,,,https://docs.microsoft.com/en-us/dynamics365-release-plan/2021wave2/finance-operations/dynamics365-finance/1099-report-revisions-2021,,,-,Jan 2022,This enhancement helps your organization maintain compliance with current regulations for 1099 processing.Feature details,This feature will add new 1099 fields to the 2021 1099-DIV form 1099-MISC form and 1099-NEC form. Electronic filing for 2021 will not be impacted by this feature since the IRS has not published the corresponding changes for electronic filing for the 1099-DIV 1099-MISC and 1099-NEC forms.
Adjust posting date automatically during invoice posting,Adjust posting date automatically during invoice posting,null,,,,,,https://docs.microsoft.com/en-us/dynamics365-release-plan/2021wave2/finance-operations/dynamics365-finance/adjust-posting-date-automatically-during-invoice-posting,,,-,Jan 2022,This feature reduces the number of manual steps that accounts payable clerks must complete when its necessary to adjust the posting date on multiple vendor invoices. The feature can also help reduce errors that might be introduced when tasks are completed manually.Feature details,Sometimes vendor invoices can remain in pending status beyond the time when the accounting period for the specified posting date has closed. When the invoices are ready to be posted the original posting date cant be used since the period is closed. As a result the accounts payable clerk must change all the posting dates on the now-unapproved invoices to the newer open period (next month). This feature adds a parameter that lets the system change the posting date automatically according to your business needs. As a result the due date cash discount date and exchange rate of the vendor invoice can be adjusted accordingly.
Create invoice lines based on the quantity option parameter in Accounts payable,Create invoice lines based on the quantity option parameter in Accounts payable,null,,,,,,https://docs.microsoft.com/en-us/dynamics365-release-plan/2021wave2/finance-operations/dynamics365-finance/create-invoice-lines-based-quantity-option-parameter-accounts-payable,,,-,Jan 2022,This feature reduces the number of tasks that an accounts payable clerk must complete when additional line items are added to invoices. By automating the process of adding line items the feature also helps your organization adapt to changing circumstances as efficiently as possible.Feature details,When a purchase order has been partially invoiced its possible that the invoice contains limited header information along with subtotals. This feature enables the system to create line items automatically when invoices are imported. The feature validates the information to avoid creating lines automatically while also importing the same lines at a different time.
Open vendor transaction report,Open vendor transaction report,null,,,,,,https://docs.microsoft.com/en-us/dynamics365-release-plan/2021wave2/finance-operations/dynamics365-finance/open-vendor-transaction-report,,,-,Jan 2022,The open vendor transaction report gives you quick access to detailed information about vendor transactions in one place.Feature details,This report provides detailed information about the open transactions for each vendor as of a specific date. For each transaction the report includes the following information:Invoice numberTransaction dateVoucher numberTransaction amount in the transaction currency and accounting currencyCredit balance in the transaction currency and accounting currencyDebit balance in the transaction currency and accounting currencySubtotal amount in the accounting currencyPayment due date
Allow positive asset depreciation,Allow positive asset depreciation,null,,,,,,https://docs.microsoft.com/en-us/dynamics365-release-plan/2021wave2/finance-operations/dynamics365-finance/allow-positive-asset-depreciation,,,-,Feb 2022,Allowing positive depreciation in a depreciation proposal lets your organization account for governmental funds that record the fund as an asset with negative value then depreciate that asset with positive depreciation.Feature details,When you let the system calculate positive depreciation the system will consider the negative book value of the asset and calculate positive depreciation (as a debit entry). The Allow net book value higher than acquisition price and Allow negative net book value options will be available after the Allow positive depreciation feature is enabled in the Feature management workspace.
Enhancements around ledger settlements,Enhancements around ledger settlements,null,,,,,,https://docs.microsoft.com/en-us/dynamics365-release-plan/2021wave2/finance-operations/dynamics365-finance/enhancements-around-ledger-settlements,,,-,Feb 2022,The ledger settlement process will be enhanced to reduce the number of manual steps through an automated settlement process. Reports and processes such as year-end close and foreign currency revaluation will better use the ledger settlement records.Feature details,This feature includes enhancements that improve processing of ledger settlements and the year-end close. These enhancements include the following:Enhancing the year-end close to account for settled transactions.Providing the option to perform settlements automatically based on rules. You can define and run the rules by using a timeframe configured from the process automation framework.Enhancing reports and inquiries to use the settlement flag and date providing an accurate picture of the detailed transactions that encompass the ledger account balance.
Financial Dimension service,Financial Dimension service,null,,,,,,https://docs.microsoft.com/en-us/dynamics365-release-plan/2021wave2/finance-operations/dynamics365-finance/financial-dimension-service,,,-,Feb 2022,The creation and validation of unique financial dimension values is a costly operation that can be improved with the Financial Dimension service which is able to operate on the data in parallel.Feature details,The new service improves the process of resolving financial dimensions when you import a large number of journals. The service works on dimension data in the imported journals in parallel with the financial dimensions in your existing data to improve the otherwise time-consuming and labor-intensive process of creating new dimension values that rationalize the existing and imported dimension values.
General ledger year-end enhancements – specify balance sheet dimensions and year end close service,General ledger year-end enhancements – specify balance sheet dimensions and year end close service,null,,,,,,https://docs.microsoft.com/en-us/dynamics365-release-plan/2021wave2/finance-operations/dynamics365-finance/general-ledger-year-end-enhancements,,,-,Feb 2022,This feature comprises a number of enhancements that improve performance during the year-end close process.Feature details,The enhancements to the year-end close process include the following:Lets you specify balance sheet financial dimensions in detail when you close a year. This functionality now parallels the capability that's available for profit and loss accounts.Improves overall performance so that the year-end-close process runs more efficiently.The following enhancements were added in the July 2021 release:Moves the setup of the year-end closing templates to a new setup page. The existing year-end close page will change similar to the general ledger foreign currency revaluation where a list will indicate each of the times the year-end close has been run or reversed. An accounting manager can initiate the year-end close from the new page.Lets accounting managers reverse a year-end close by selecting the most recent fiscal year and selecting the Reverse year-end close button. The reversal will delete the accounting entries for the previous year-end close but won't rerun the year-end close automatically.Requires voucher numbers when closing a year where this was optional (based on a parameter setting in General ledger) in previous versions.Maintains the history and audit trail of previously closed years by company and year.
Increase the length of invoice numbers,Increase the length of invoice numbers,null,,,,,,https://docs.microsoft.com/en-us/dynamics365-release-plan/2021wave2/finance-operations/dynamics365-finance/increase-length-invoice-numbers,,,-,Feb 2022,This feature increases the length of invoice numbers in Accounts payable which gives you more flexibility to adapt invoice numbers in ways that better serve your organization's needs.Feature details,This feature increases the length of vendor invoice numbers by letting you extend specific extended data types based on unique business processes. Extending the data types that determine the length of vendor invoice numbers won't adversely affect other extended data types.
Invoice automation – process vendor invoices during the import process,Invoice automation – process vendor invoices during the import process,null,,,,,,https://docs.microsoft.com/en-us/dynamics365-release-plan/2021wave2/finance-operations/dynamics365-finance/invoice-automation--process-vendor-invoices-during-when-importing,,,-,Feb 2022,This feature is part the vendor invoice automation capability and saves accounts payable clerks time and effort by processing vendor invoices automatically. The feature can also help reduce errors that arise through manual processing.Feature details,Creating vendor invoices can involve multiple steps including applying prepayments completing the invoice matching process validating invoices and then submitting them to workflow processing. Typically those steps are completed manually before the invoices are posted. Prior to implementing this feature importing vendor invoices resulted in a pending vendor invoice. Routine invoice processing steps such as applying prepayments were completed in the background. This feature lets the system process vendor invoices automatically when the invoices are imported eliminating the need for additional background processing and freeing accounts payable staff to focus their efforts on exceptions.
Finance insights,Finance insights,Finance insights,,,,,,https://docs.microsoft.com/en-us/dynamics365-release-plan/2021wave2/finance-operations/dynamics365-finance/planned-features,,,,,,
Customer payment predictions,Customer payment predictions,null,,,,,,https://docs.microsoft.com/en-us/dynamics365-release-plan/2021wave2/finance-operations/dynamics365-finance/customer-payment-predictions,,,-,Oct 2021,Knowing when all of a customer's outstanding invoices are likely to be paid in addition to knowing when specific invoices are likely to be paid can help businesses optimize the start of collection activities.Feature details,Customer payment predictions help answer and respond constructively to the following questions:When will an invoice or sales order be paid?Which customers will pay on time and which will pay late?Which invoices or orders will they pay?
External data for cash flow forecasting,External data for cash flow forecasting,null,,,,,,https://docs.microsoft.com/en-us/dynamics365-release-plan/2021wave2/finance-operations/dynamics365-finance/external-data-cash-forecasting,,,-,Oct 2021,You can enter or import external data into cash flow forecasts which helps improve the accuracy of forecasts.Feature details,This feature lets you include external data in cash flow forecasting. It brings the capability to import external data from supporting systems into the cash flow engine to improve the accuracy of cash flow forecasting.
Forecast bank balance,Forecast bank balance,null,,,,,,https://docs.microsoft.com/en-us/dynamics365-release-plan/2021wave2/finance-operations/dynamics365-finance/forecast-bank-balance,,,-,Oct 2021,The cash flow forecasting capability in finance insights can help companies monitor and manage their cash balances effectively. It can also help managers make decisions that optimize opportunities in the context of their current cash position.Feature details,Forecasts of bank balances will be based on recurring activities in addition to information from customer payment and vendor payments. The bank balance forecasts help treasurers more accurately understand the availability of funds at specific times.
Intelligent budget proposal,Intelligent budget proposal,null,,,,,,https://docs.microsoft.com/en-us/dynamics365-release-plan/2021wave2/finance-operations/dynamics365-finance/intelligent-budget-proposal,,,-,Oct 2021,Organizations spend a lot of time and resources preparing their budgets and much of that effort is repetitive and low-value-added. Still more work is needed to prepare line-by-line budgets for each department. Intelligent budget proposals make it easy to gather historical data from actuals or budgets to use for budgeting within Dynamics 365 Finance. The feature uses that data to generate a new budget that can be further refined by staff who possess knowledge and insights that might not be present in historical data.Feature details,The intelligent budget proposal feature lets you create a draft budget automatically but with a high degree of confidence from the use of historical data. The feature must be turned on in the Feature management workspace. The more years of budget data that you can provide to the system to generate budget proposals the more accurate the proposals can be. Having from three to five years of historical data at minimum can help ensure the accuracy of the proposals that are generated.
Treasurer workspace,Treasurer workspace,null,,,,,,https://docs.microsoft.com/en-us/dynamics365-release-plan/2021wave2/finance-operations/dynamics365-finance/treasurer-workspace,,,-,Oct 2021,The cash flow forecasting capability in finance insights can help companies monitor and manage their cash balances effectively.Feature details,This feature adds a new workspace that includes all necessary elements for completing the analysis and activities that treasurers need to successfully manage their organization's cash. The workspace includes payment predictions on open customer and vendor orders and invoices to provide you an accurate cash position. Create cash flow forecast snapshots edit them and save them to compare against actuals later.
Globalization,Globalization,Globalization,,,,,,https://docs.microsoft.com/en-us/dynamics365-release-plan/2021wave2/finance-operations/dynamics365-finance/planned-features,,,,,,
