NodeName,Title,Description,ContactName,EmailAddress,ImageFileName,ExternalURL,InternalURL,ExternalOnePage,EmailSubject,HTMLResult,PublicPreview,GeneralAvailability,BusinessValue,FeatureDetails
Use multiple units of measure when synchronizing items and resources to Dynamics 365 Sales,Use multiple units of measure when synchronizing items and resources to Dynamics 365 Sales,null,,,,,,https://docs.microsoft.com/en-us/dynamics365-release-plan/2021wave2/smb/dynamics365-business-central/use-multiple-units-measure-when-synchronizing-items-resources-dynamics-365-sales,,,Sep 1 2021,Oct 2021,Businesses often track inventory for items in one unit of measure such as pieces but due to different market needs they may sell the items in several different units of measure such as boxes or containers. Integration between Business Central and Microsoft Dynamics 365 Sales now allows these services to exchange information about items in multiple units of measure.Feature details,When you enable the Feature Update: Multiple Units of Measure Synchronization with Dynamics 365 Sales feature in Feature Management Business Central will create unit groups for items and resources through the data update process.You can now view two new integration table mappings for Item Units of Measure (ITEM-UOM) and Resource Units Of Measure (RESOURCE-UOM).Item or resource unit groups automatically generate sets of units of measure for items and resources that match the units in Dynamics 365 Sales. On the Item Unit Group List or Resource Unit Group List pages you can view coupled unit groups by choosing the Unit Group action you can synchronize unit group data by using the Synchronize action and couple or delete unit groups by choosing Coupling Set up coupling or Delete coupling.From the Item Units of Measure and Resource Units of Measure pages for each units of measure in a unit group you can now view the coupled unit by choosing the Unit action use the Synchronize action to synchronize unit data or couple or delete a coupling by choosing Coupling Set up coupling or Delete coupling.NoteYou need to have the Feature Update: Multiple Units of Measure Synchronization with Dynamics 365 Sales feature enabled in Feature Management to use this capability.Tell us what you thinkHelp us improve Dynamics 365 Business Central by discussing ideas providing suggestions and giving feedback. Use the forum at https://aka.ms/bcideas.Thank you for your ideaThank you for submitting this idea. We listened to your idea along with comments and votes to help us decide what to add to our product roadmap.See alsoSynchronization Rules (docs)
More educational app tours for standard roles,More educational app tours for standard roles,null,,,,,,https://docs.microsoft.com/en-us/dynamics365-release-plan/2021wave2/smb/dynamics365-business-central/more-educational-app-tours-standard-roles,,,Oct 2021,Nov 2021,Businesses want to onboard new employees quickly and efficiently and one of the ways that Business Central supports that is by offering in-product tours that point out the information and tools that people need in their business role. In this release we're adding tours to even more areas of the application.Feature details,With 2021 release wave 1 Business Central started surfacing extensible in-product tours that help users understand important concepts and business entities. In 2021 release wave 2 we've expanded support for onboarding business roles by adding built-in tours that cover even more standard entities. The new tours will reduce friction in the learning and startup phase and can be viewed or revisited on demand.Tell us what you thinkHelp us improve Dynamics 365 Business Central by discussing ideas providing suggestions and giving feedback. Use the forum at https://aka.ms/bcideas.
Delegated admin can create job queue entries and request approval by a licensed user,Delegated admin can create job queue entries and request approval by a licensed user,null,,,,,,https://docs.microsoft.com/en-us/dynamics365-release-plan/2021wave2/smb/dynamics365-business-central/delegated-admin-create-job-queue-entries-request-approval-licensed-user,,,Sep 2021,Nov 2021,The delegated admin role enables Microsoft partners to set up and manage certain aspects of Business Central on behalf of their customers. The role is however limited in some ways. Among these limitations is the ability to create job queue entries and set them as ready to run for customers. Job queue entries are important tools for setting up and configuring Business Central tenants. Delegated admins can create job queue entries and request approval from a licensed user.Feature details,Business Central provides the delegated admin role so that people who are not employed by the customer typically Microsoft partners can set up and configure business processes for the customers. The delegated admin role is not however a licensed user in Business Central and often is only assigned temporarily so there are some limitations to what they can do. For example delegated admins cannot set up tasks that might be run after the delegated admin relationship has been revoked such as job queue entries.That has been problematic because job queue entries are useful tools for running setup and configuration processes in Business Central and delegated admins need to be able to create and run them in their customer's tenant. In this release delegated admins can create job queue entries and set them as ready to run. Then a licensed user from the customer can start the job queue entry to complete the process that the delegated admin created.Tell us what you thinkHelp us improve Dynamics 365 Business Central by discussing ideas providing suggestions and giving feedback. Use the forum at https://aka.ms/bcideas.See alsoDelegated Administrator Access to Business Central Online (docs)
Better with Microsoft 365,Better with Microsoft 365,Better with Microsoft 365,,,,,,https://docs.microsoft.com/en-us/dynamics365-release-plan/2021wave2/smb/dynamics365-business-central/planned-features,,,,,,
Enhancements to Microsoft Teams integration,Enhancements to Microsoft Teams integration,null,,,,,,https://docs.microsoft.com/en-us/dynamics365-release-plan/2021wave2/smb/dynamics365-business-central/enhancements-teams-integration,,,-,Oct 2021,The Business Central app for Microsoft Teams connects Teams to your business data so you can quickly share details with your team connect with your business contacts and respond faster to inquiries.Feature details,The 2021 release wave 2 includes the following improvements to the Business Central app for Teams:New sign-up experience for users who are installing the app but don't have a Business Central subscription. Users will be redirected to a page where they can read about and sign up for a trial subscription.Two new ways of sharing data between Business Central and Teams. For more information see the following related features of this release: AL API for sharing files in Microsoft 365 and Share a link to any record directly from Business Central to Microsoft Teams.
Centralized Deployment of Office add-ins,Centralized Deployment of Office add-ins,null,,,,,,https://docs.microsoft.com/en-us/dynamics365-release-plan/2021wave2/smb/dynamics365-business-central/centralized-deployment-office-add-ins,,,Aug 1 2021,Oct 2021,The security of your business data is important to us. Administrators are in control of how Office add-ins for Business Central are deployed to individuals groups or the entire organization by using best-of-breed compliance and policy settings in Microsoft 365.Feature details,When getting started with Business Central assisted setup wizards will guide administrators through the process of configuring the Business Central Office add-ins.Excel add-inThe new Centralized Deployment assisted setup will guide administrators through the manual task of configuring Microsoft 365 to deploy add-ins to select users within the organization when individual acquisition from the Office Store has been turned off.Outlook add-insThe Centralized Deployment assisted setup for Outlook add-ins replaces the earlier Business Inbox setup wizard. The new assisted setup will walk administrators through the manual task of configuring Microsoft 365 or Exchange Server to deploy add-ins to select users within the organization.To support improved security in Exchange and take advantage of custom Exchange policy the assisted setup no longer automates deployment by using legacy basic authentication.Tell us what you thinkHelp us improve Dynamics 365 Business Central by discussing ideas providing suggestions and giving feedback. Use the forum at https://aka.ms/bcideas.
Enhancements to the Outlook add-in,Enhancements to the Outlook add-in,null,,,,,,https://docs.microsoft.com/en-us/dynamics365-release-plan/2021wave2/smb/dynamics365-business-central/enhancements-outlook-add-in,,,Aug 1 2021,Oct 2021,Set up your business inbox in Outlook to respond faster to inquiries from your customers vendors and prospects.Feature details,The 2021 release wave 2 includes various technical improvements for deploying and using Outlook add-ins:You can use the add-ins with companies that have symbols or non-English characters in the company name.A simplified wizard distributes the Outlook add-ins to individual users. Automated installation of the add-ins now uses the more secure OAuth 2.0 that replaces legacy basic authentication.Administrators can configure Microsoft 365 for centralized deployment of the Outlook add-in to individuals groups or everyone within their organization. For more information see the Centralized Deployment release plan.Update to minimum requirementsIn 2021 release wave 2 version 19 of Business Central the Outlook add-ins require the Outlook client to be version 2012 or later and will also require that the WebView2 component is installed to the relevant devices. Users of Outlook clients that don't meet the minimum requirements might not be able to sign in to the add-in from version 19 and later.For more tips and tricks to help you get an optimal experience with Outlook see Optimizing Outlook for Your Business Inbox.About the legacy Outlook synchronization capabilityIn this release wave we deprecate the legacy Outlook synchronization feature. The Business Central components for Outlook can no longer be installed from the installer for Business Central (on-premises) and the feature can't be accessed from Business Central.See alsoOptimizing Outlook for Your Business Inbox (docs)
Enhancements to working with Microsoft Excel,Enhancements to working with Microsoft Excel,null,,,,,,https://docs.microsoft.com/en-us/dynamics365-release-plan/2021wave2/smb/dynamics365-business-central/enhancements-working-excel,,,Aug 10 2021,Oct 2021,For many of our customers Microsoft Excel remains the app of choice for quick data analysis sharing tabular data bulk correcting or entering records. Business Central continues to mature Excel-related features for exporting to Excel and working with the Excel add-in making them more easily discoverable and reachable through the new Share menu.Feature details,A new home for Open in Excel and Edit in ExcelThe 2021 release wave 2 introduces the Share icon and menu in which users will find the Open in Excel and Edit in Excel actions. This applies to list pages such as the Items list and also to list parts that display a full menu such as the Lines part on a sales order.Downloading embedded lists to Excel (Open in Excel action)Lists that are embedded in a part on a page can now be exported to Excel. For example you can export Sales Lines on a Sales Order list parts on the Role Center or lists in the FactBox pane. Similar to full-page lists the Open in Excel action downloads a static copy of your list as an Excel file applying your filters and sort order just as shown on screen.You can enable this feature ahead of time as early as Business Central 2021 release wave 1 (update 18.3). Starting in Business Central 2021 release wave 2 (update 19.0) this is enabled on all environments.Exporting reports to ExcelFrom a report request page users can export report data to Excel. The Excel file will only include the raw data not the report layout. For more information see the related release plan: Save report dataset to Excel from the request page.You can enable this feature ahead of time as early as Business Central 2021 release wave 1 (update 18.3). Starting in Business Central 2021 release wave 2 (update 19.0) this is enabled on all environments.Enhancements to the Excel add-in (Edit in Excel)Administrators can now configure Business Central and Microsoft 365 to use Centralized Deployment to deploy the Excel add-in to users or groups of users within their organization. For more information see the related release plan: Centralized Deployment of Office add-ins.Columns are now exported using the column captions that match your current language in Business Central.Tell us what you thinkHelp us improve Dynamics 365 Business Central by discussing ideas providing suggestions and giving feedback. Use the forum at https://aka.ms/bcideas.Thank you for your ideaThank you for submitting this idea. We listened to your idea along with comments and votes to help us decide what to add to our product roadmap.
AL API for sharing files in Microsoft 365,AL API for sharing files in Microsoft 365,null,,,,,,https://docs.microsoft.com/en-us/dynamics365-release-plan/2021wave2/smb/dynamics365-business-central/al-api-sharing-files-365,,,Sep 2021,Oct 2021,Bring the best of Microsoft's business and productivity suites together to initiate collaborative review and sharing activities directly from Business Central.Feature details,AL developers will be able to implement sharing of their reports or other files using standard Microsoft 365 capabilities for cloud-based file sharing. For example this could be used to build an experience where users share a custom financial report over email.
Share a record link to Microsoft Teams,Share a record link to Microsoft Teams,null,,,,,,https://docs.microsoft.com/en-us/dynamics365-release-plan/2021wave2/smb/dynamics365-business-central/share-record-link-teams,,,Sep 2021,Oct 2021,Users save time and benefit from reduced app switching when they can initiate collaborative tasks directly from Business Central.Feature details,The Business Central web client will include a new action to share to Microsoft Teams. This action allows users to type a message choose recipients such as team members groups or channels and send their message with a link to the Business Central record.Similar to the Business Central app for Teams the Share to Teams action in the web client is only available to Business Central online users.Tell us what you thinkHelp us improve Dynamics 365 Business Central by discussing ideas providing suggestions and giving feedback. Use the forum at https://aka.ms/bcideas.
Country and regional,Country and regional,Country and regional,,,,,,https://docs.microsoft.com/en-us/dynamics365-release-plan/2021wave2/smb/dynamics365-business-central/planned-features,,,,,,
Country and regional expansion – Argentina,Country and regional expansion – Argentina,null,,,,,,https://docs.microsoft.com/en-us/dynamics365-release-plan/2021wave2/smb/dynamics365-business-central/countryregional-expansion--argentina,,,-,Nov 2021,There is a large demand for Dynamics 365 Business Central online. We are increasing the global availability to cover more countries and regions so that small and midsized businesses across the world can achieve more.Feature details,Expansion to Argentina is achieved through partner-led localization. Our partners create the relevant localization apps that are then published to AppSource. In combination with the built-in language offerings Dynamics 365 Business Central is then available to serve customers in Argentina.Tell us what you thinkHelp us improve Dynamics 365 Business Central by discussing ideas providing suggestions and giving feedback. Use the forum at https://aka.ms/bcideas.
Country and regional expansion – Bulgaria,Country and regional expansion – Bulgaria,null,,,,,,https://docs.microsoft.com/en-us/dynamics365-release-plan/2021wave2/smb/dynamics365-business-central/countryregional-expansion--bulgaria,,,-,Nov 2021,There is a large demand for Dynamics 365 Business Central online. We are increasing the global availability to cover more countries and regions so that small and midsized businesses across the world can achieve more.Feature details,Expansion to Bulgaria is achieved through partner-led localization. Our partners create the relevant localization apps that are then published to AppSource. In combination with the built-in language offerings Dynamics 365 Business Central is then available to serve customers in Bulgaria.Tell us what you thinkHelp us improve Dynamics 365 Business Central by discussing ideas providing suggestions and giving feedback. Use the forum at https://aka.ms/bcideas.
Country and regional expansion – Chile,Country and regional expansion – Chile,null,,,,,,https://docs.microsoft.com/en-us/dynamics365-release-plan/2021wave2/smb/dynamics365-business-central/countryregional-expansion--chile,,,-,Nov 2021,There is a large demand for Dynamics 365 Business Central online. We are increasing the global availability to cover more countries and regions so that small and midsized businesses across the world can achieve more.Feature details,Expansion to Chile is achieved through partner-led localization. Our partners create the relevant localization apps that are then published to AppSource. In combination with the built-in language offerings Dynamics 365 Business Central is then available to serve customers in Chile.Tell us what you thinkHelp us improve Dynamics 365 Business Central by discussing ideas providing suggestions and giving feedback. Use the forum at https://aka.ms/bcideas.
Country and regional expansion – Myanmar,Country and regional expansion – Myanmar,null,,,,,,https://docs.microsoft.com/en-us/dynamics365-release-plan/2021wave2/smb/dynamics365-business-central/countryregional-expansion--myanmar,,,-,Nov 2021,There is a large demand for Dynamics 365 Business Central online. We are increasing the global availability to cover more countries and regions so that small and midsized businesses across the world can achieve more.Feature details,Expansion to Myanmar is achieved through partner-led localization. Our partners create the relevant localization apps that are then published to AppSource. In combination with the built-in language offerings Dynamics 365 Business Central is then available to serve customers in Myanmar.Tell us what you thinkHelp us improve Dynamics 365 Business Central by discussing ideas providing suggestions and giving feedback. Use the forum at https://aka.ms/bcideas.
Country and regional expansion – Puerto Rico,Country and regional expansion – Puerto Rico,null,,,,,,https://docs.microsoft.com/en-us/dynamics365-release-plan/2021wave2/smb/dynamics365-business-central/countryregional-expansion--puerto-rico,,,-,Nov 2021,There is a large demand for Dynamics 365 Business Central online. We are increasing the global availability to cover more countries and regions so that small and midsized businesses across the world can achieve more.Feature details,Expansion to Puerto Rico is achieved through partner-led localization. Our partners create the relevant localization apps that are then published to AppSource. In combination with the built-in language offerings Dynamics 365 Business Central is then available to serve customers in Puerto Rico.Tell us what you thinkHelp us improve Dynamics 365 Business Central by discussing ideas providing suggestions and giving feedback. Use the forum at https://aka.ms/bcideas.
Country and regional expansion – Slovakia,Country and regional expansion – Slovakia,null,,,,,,https://docs.microsoft.com/en-us/dynamics365-release-plan/2021wave2/smb/dynamics365-business-central/countryregional-expansion--slovakia,,,-,Nov 2021,There is a large demand for Dynamics 365 Business Central online. We are increasing the global availability to cover more countries and regions so that small and midsized businesses across the world can achieve more.Feature details,Expansion to Slovakia is achieved through partner-led localization. Our partners create the relevant localization apps that are then published to AppSource. In combination with the built-in language offerings Dynamics 365 Business Central is then available to serve customers in Slovakia.Tell us what you thinkHelp us improve Dynamics 365 Business Central by discussing ideas providing suggestions and giving feedback. Use the forum at https://aka.ms/bcideas.
Country and regional expansion – Ukraine,Country and regional expansion – Ukraine,null,,,,,,https://docs.microsoft.com/en-us/dynamics365-release-plan/2021wave2/smb/dynamics365-business-central/countryregional-expansion--ukraine,,,-,Nov 2021,There is a large demand for Dynamics 365 Business Central online. We are increasing the global availability to cover more countries and regions so that small and midsized businesses across the world can achieve more.Feature details,Expansion to Ukraine is achieved through partner-led localization. Our partners create the relevant localization apps that are then published to AppSource. In combination with the built-in language offerings Dynamics 365 Business Central is then available to serve customers in Ukraine.Tell us what you thinkHelp us improve Dynamics 365 Business Central by discussing ideas providing suggestions and giving feedback. Use the forum at https://aka.ms/bcideas.
Development,Development,Development,,,,,,https://docs.microsoft.com/en-us/dynamics365-release-plan/2021wave2/smb/dynamics365-business-central/planned-features,,,,,,
Generated documentation for AL language,Generated documentation for AL language,null,,,,,,https://docs.microsoft.com/en-us/dynamics365-release-plan/2021wave2/smb/dynamics365-business-central/generated-documentation-al-language,,,-,Oct 2021,Reference documentation is an important part of a programming language. In this release we have increased coverage of auto-generated documentation for the AL language ensuring that this is in sync with the latest changes and additions. Specifically we are adding properties triggers method options and method attributes.Feature details,AL reference documentation is used to look up documentation of types method and properties in the programming language. For many releases this documentation has been handcrafted which can lead to inconsistencies with the actual language. To ensure that the documentation is in sync with the language entries will be auto-generated and any additional content will be added manually afterward. This ensures full coverage and that the documentation better reflects the AL language as it evolves.
Profiling AL performance with snapshot debugger,Profiling AL performance with snapshot debugger,null,,,,,,https://docs.microsoft.com/en-us/dynamics365-release-plan/2021wave2/smb/dynamics365-business-central/profiling-al-performance-snapshot-debugger,,,Aug 1 2021,Oct 2021,Performance is top of mind for most customers especially in the world of online business. Until now apart from selected reactive telemetry allowing monitoring of customer tenants there has not been a proactive way to measure execution performance during development nor when troubleshooting specific customer support cases with performance issues. To address this we are introducing the ability to capture execution timing as part of a snapshot and investigate this in Visual Studio Code when replaying the snapshot.Feature details,Snapshot captures now include a performance profile of the executed code that is captured in the snapshot. Using a new performance profiling editor view in the AL Visual Studio Code extension developers can then investigate the time spent on execution either using top-down or bottom-up call stack views.
Transactional installation and sync of extensions on-premises,Transactional installation and sync of extensions on-premises,null,,,,,,https://docs.microsoft.com/en-us/dynamics365-release-plan/2021wave2/smb/dynamics365-business-central/transactional-installing-syncing-extensions-on-premise,,,Aug 1 2021,Oct 2021,Usually installing and synchronizing extensions are performed as two distinct operations. To enable force synchronization in online environments install and sync can now also be performed as one transactional operation per database available for PowerShell scripts on-premises.Feature details,As a prerequisite for force sync support of extensions in online environments the ability to install and sync extensions as one transaction per database has been added. This capability is also available on-premises so that you can choose to only install extensions that can also synchronize for example.See alsoAdministration of Business Central On-Premises (docs)
