NodeName,Title,Description,ContactName,EmailAddress,ImageFileName,ExternalURL,InternalURL,ExternalOnePage,EmailSubject,HTMLResult,PublicPreview,GeneralAvailability,BusinessValue,FeatureDetails
0,1,2,3,4,5,6,7,8,9,10,,,,
Marketing,Marketing,Marketing,,,,,,https://docs.microsoft.com/en-us/dynamics365-release-plan/2021wave2/,,,,,,
Dynamics 365 Marketing,Dynamics 365 Marketing,Dynamics 365 Marketing,,,,,,https://docs.microsoft.com/en-us/dynamics365-release-plan/2021wave2/marketing/dynamics365-marketing/,,,,,,
Analytics and AI,Analytics and AI,Analytics and AI,,,,,,https://docs.microsoft.com/en-us/dynamics365-release-plan/2021wave2/marketing/dynamics365-marketing/planned-features,,,,,,
Create email content easily and efficiently with AI-based content ideas,Create email content easily and efficiently with AI-based content ideas,null,,,,,,https://docs.microsoft.com/en-us/dynamics365-release-plan/2021wave2/marketing/dynamics365-marketing/create-email-content-easily-efficiently-ai-based-content-ideas,,,Oct 2021,-,How great would it be if your email editor could suggest relevant and engaging content? AI-based content ideas do just that. They help you find inspiration and can be used as a starting point when composing an email for your audience. Its like asking a group of colleagues to brainstorm with you. Content ideas make the email creation process simpler more efficient and fun. It's a completely new and innovative functionality with the latest technologies behind the scenes.Feature details,AI-based content ideas automatically generate a set of content snippets (based on provided key points) to serve as an inspiration for your email. You'll be able to review select and fine-tune generated content ideas based on your needs.
New email editor with A/B testing,New email editor with A/B testing,null,,,,,,https://docs.microsoft.com/en-us/dynamics365-release-plan/2021wave2/marketing/dynamics365-marketing/new-email-editor-ab-testing,,,-,Oct 2021,With the revamped email editor we have designed a completely new way to create engaging and relevant content. The improved email editor is optimized for a productive workflow. The email editor includes real-time validation making it easy to produce professional emails with less time and effort. With this release the email editor is further enhanced with A/B testing functionality. The new email editor is automatically enabled for all customers.Feature details,Fast and fluid editor with a modern look and feel.More editing space.Flexible layout options allowing you to create emails without compromises.Advanced image manipulation and editing capabilities.Reliable email previews and accurate rendering.NoteAs part of this release the previous email editor is deprecated.
Moments-based,Moments-based,Moments-based,,,,,,https://docs.microsoft.com/en-us/dynamics365-release-plan/2021wave2/marketing/dynamics365-marketing/planned-features,,,,,,
Connect Customer Insights and your own data lake with customer journey orchestration,Connect Customer Insights and your own data lake with customer journey orchestration,null,,,,,,https://docs.microsoft.com/en-us/dynamics365-release-plan/2021wave2/marketing/dynamics365-marketing/connect-customer-insights-own-data-lake-adl-v2-customer-journey-orchestration,,,Dec 2021,-,Many customers choose to store their Customer Insights data in their own Azure Data Lake Storage.You can now use data stored in Azure Data Lake Storage to build segments specify conditions and personalize messages to build rich real-time journeys while maintaining full control over the underlying data.Feature details,Customer journeys can use Customer Insights data such as customer profile and segment information that is stored in Azure Data Lake Storage in the same way you do today with standard Customer Insights connected to Microsoft Dataverse. You can:Target customers based on real-time event-triggered customer journeys.Deeply personalize your engagement using rich Customer Insights data.Close the feedback loop with customer interactions from Dynamics 365 Marketing customer journeys available in the Customer Insights activity timeline.
A/B testing in the new outbound marketing email editor,A/B testing in the new outbound marketing email editor,null,,,,,,https://docs.microsoft.com/en-us/dynamics365-release-plan/2021wave2/marketing/dynamics365-marketing/ab-testing-new-outbound-marketing-email-editor,,,-,Oct 2021,One of the best ways to learn which of several possible email designs will produce the best results is to try each design on a different subset of your audience and then analyze interaction records to see how each design was received. Marketers call this A/B testing. Dynamics 365 Marketing now has this capability built into the new email editor allowing marketers to create an alternative version of a message and test it in a customer journey.Feature details,A/B testing in the new outbound marketing email editor allows you to:Define different types of A/B tests:Header (subject from): Lets you choose a different subject or different &quot;from&quot; name for the B version of your design.Body: Lets you select one or more design elements in the email body and change those elements' settings content or apperance in the B version of the design.Full content: Lets you select a different subject &quot;from&quot; name and one or more design elements in the email body and then change those elements' settings content or apperance in the B version of the design.Preview and test-send version A and version B of your email.Analyze the results of the A/B test in a customer journey and in email insights.NoteIf you already have added an A/B test into your email using the old editor it will be visible and fully supported in the new editor.
Send SMS messages using Twilio and TeleSign integration,Send SMS messages using Twilio and TeleSign integration,null,,,,,,https://docs.microsoft.com/en-us/dynamics365-release-plan/2021wave2/marketing/dynamics365-marketing/send-sms-messages-using-twillio-telesign-integration,,,-,Oct 2021,SMS messaging through the Dynamics 365 Marketing mobile channel creates new opportunities to connect with mobile users. The SMS channel enables fast transactional communication and marketing messaging to use as a part of campaigns and customer service communication. We're extending these capabilities by enabling integration with Twilio and TeleSign.Feature details,Integration with Twilio and TeleSign happens through a common Omnichannel service shared with Dynamics 365 Customer Service. You can purchase or reuse existing SMS accounts with Twilio or TeleSign and it'll be possible to purchase Azure Communication Services phone numbers in the regions where Azure Communication Services SMS phone numbers are supported. For more information go to Phone number types in Azure Communication Services.
Visualize customer journey interactions on the Customer Insights activity timeline,Visualize customer journey interactions on the Customer Insights activity timeline,null,,,,,,https://docs.microsoft.com/en-us/dynamics365-release-plan/2021wave2/marketing/dynamics365-marketing/visualize-customer-journey-interactions-customer-insights-activity-timeline,,,-,Dec 2021,Create a timeline to visualize all customer activities chronologically by combining customer interactions with Dynamics 365 Marketing customer journeys andother data sourcesin Dynamics 365 Customer Insights. Empower sales serviceand other frontline agents to deeply personalize relationships through knowledge of every customer's engagement history.Feature details,When Customer Insights and Dynamics 365 Marketing are connected all marketing interactions (such as message sent opened or clicked) are available as activities in Customer Insights. Admins can add any or all of these interactions into the Customer Insights timeline. You can include this combined timeline in Dynamics 365 apps with the Customer Card add-insolution or in a Power BI dashboard. Marketing interactionscan be viewed alongside other data sources like CRM ERP popular data warehouses POS systemsyour websites and so on.
Create a webinar registration experience in Teams then design the participants' journey in Marketing with a few clicks,Create a webinar registration experience in Teams then design the participants' journey in Marketing with a few clicks,null,,,,,,https://docs.microsoft.com/en-us/dynamics365-release-plan/2021wave2/marketing/dynamics365-marketing/create-webinar-registration-experience-teams-then-design-participants-journey-marketing-few-clicks,,,Oct 2021,Dec 2021,Create webinars and manage participant registrations in Microsoft Teams that are seamlessly connected to Dynamics 365 Marketing. In Dynamics 365 Marketing create rich personalized messages and send automated emails to webinar participants based on registration and attendance triggers and use analytics to optimize results.Feature details,Create branded registration pages in Microsoft Teams that are integrated out of the box with Dynamics 365 MarketingManage registrations including approve decline and waitlist functionalityEasily trigger journeys in Dynamics 365 Marketing based on user behaviors in Microsoft Teams
Personalization,Personalization,Personalization,,,,,,https://docs.microsoft.com/en-us/dynamics365-release-plan/2021wave2/marketing/dynamics365-marketing/planned-features,,,,,,
Create segments for contacts and leads in the new segmentation builder,Create segments for contacts and leads in the new segmentation builder,null,,,,,,https://docs.microsoft.com/en-us/dynamics365-release-plan/2021wave2/marketing/dynamics365-marketing/create-segments-leads-custom-entities-new-segmentation-builder,,,Nov 2021,-,To improve marketing return on investment it is important to target the right audience. The new segmentation builder simplifies segment creation no matter how complex the logic. In addition it enables you to build segments on leads without requiring the lead to have a parent contact. You can then market to these leads directly using customer journeys.Feature details,Directly create segments based on attribute data for both contacts and leads.Discover and search across all attributes in the right pane and add them to your queries.Preview and estimate the number of segment members as part of your segment creation process.
Deliver rich customer experiences across Dynamics 365 Office and other apps by augmenting customer journeys with Power Automate,Deliver rich customer experiences across Dynamics 365 Office and other apps by augmenting customer journeys with Power Automate,null,,,,,,https://docs.microsoft.com/en-us/dynamics365-release-plan/2021wave2/marketing/dynamics365-marketing/deliver-rich-customer-experiences-across-dynamics-365-office-other-apps-augmenting-customer-journeys-with%C2%A0power-automate,,,Nov 2021,-,Because every business is unique connecting systems and leveraging existing flow is critical. Enable limitless customization and fine-grained control of your customer experience by using Power Automate flows to enhance customer journeys. Power Automate flows can raise events that can trigger a journey or steps within a journey. You can call a Power Automate flow from the journey canvas to connect with proprietary and external business systems. This end-to-end integration allows you to leverage the entire Power Automate ecosystem of connectors and controls to deliver the unique experience your customers demand.Feature details,Use Dynamics 365 Marketing as the hub of your automation leveraging first and third-party data sources through Power Automate triggers to react to important customer interactionswith your brand. Then use Power Automate connectors to deliver the best experience with a digital or physical channel.Invoke a Power Automate flow from any point in the customer journey and access the rich ecosystem of actions and triggers from proprietary and external business systems as well as actions from hundreds of apps. For instance from a customer journey that seeks feedback with a survey update your team via a Teams channel in real-time as feedback comes in.Trigger a customer journey from a Power Automate flow. For instancewhen a back-ordered item is back in stocktrigger a marketing campaign for customers who previously attempted to buy the item.
Sales,Sales,Sales,,,,,,https://docs.microsoft.com/en-us/dynamics365-release-plan/2021wave2/,,,,,,
Dynamics 365 Sales,Dynamics 365 Sales,Dynamics 365 Sales,,,,,,https://docs.microsoft.com/en-us/dynamics365-release-plan/2021wave2/sales/dynamics365-sales/,,,,,,
Accelerator workspace,Accelerator workspace,Accelerator workspace,,,,,,https://docs.microsoft.com/en-us/dynamics365-release-plan/2021wave2/sales/dynamics365-sales/planned-features,,,,,,
Seller KPIs and manager dashboards to encourage productivity,Seller KPIs and manager dashboards to encourage productivity,null,,,,,,https://docs.microsoft.com/en-us/dynamics365-release-plan/2021wave2/sales/dynamics365-sales/seller-kpis-manager-dashboards-encourage-productivity,,,Dec 2021,-,Keeps sales organizations up to date on important KPIs and enables sellers to be more data-driven with their decision making.Feature details,Manager dashboard: Allow managers to view their team's performance and coach and guide sellers:Number of active leads in the org versus previous periods.The conversion ratio between leads and opportunity.Leads by sources types.Leads per sellers.Real-time seller KPIs: The ability for organizations to define key performance indicators for sellers and allow them to see progress in real time:Number of qualified leads.Number of calls.Number of meetings.Estimated value.NoteThis feature is available in Unified Interface only.This functionality might require a separate add-in license. See Dynamics 365 Sales pricing to compare plans.
Advanced filtering and sorting,Advanced filtering and sorting,null,,,,,,https://docs.microsoft.com/en-us/dynamics365-release-plan/2021wave2/sales/dynamics365-sales/advanced-filtering-sorting,,,-,Oct 2021,Sellers manage numerous customers and activities. To quickly finish a task at hand sellers at times focus on executing the tasks without properly prioritizing them and end up concentrating on activities that have a lower impact on business outcomes. This functionality will help sellers to focus on the right customers and spend time more efficiently by engaging with the highest priority customers rather than searching the information.Feature details,This functionality will enable sellers to filter information based on standard as well as custom fields. The functionality can be enabled from the settings where a sales engagement manager (SEM) can define filters relevant for business scenarios. A SEM would be able to extend the current filter based on standard custom and a combination of fields.
Sequence management and connected screen enhancement,Sequence management and connected screen enhancement,null,,,,,,https://docs.microsoft.com/en-us/dynamics365-release-plan/2021wave2/sales/dynamics365-sales/sequence-management-connected-screen-enhancement,,,-,Oct 2021,Sales enablement managers (SEMs) and sales managers need to define the customer engagement best practices and outreach strategies that can scale to an organizations needs increase sales growth and optimize sales team productivity. These features will enable SEMs to easily maintain sequences and track progress.Feature details,Sequence Management: An enhanced UI that allows users to easily filter create default views and manage sequences. Advanced grid that allows users to perform field level filters and mass actions.Tagging: Over a period of time the number of sequences in the system can increase multifold. This feature would help the SEMs to easily maintain of these sequences. This will help SEMs to:Check if a relevant sequence exists before creating a new one.Group similar sequences together.Look at a list of sequences relevant to a business unit or scenario.Remove all the irrelevant sequences from the view.NoteThis feature is available in Unified Interface only.
Show sequence details in grid,Show sequence details in grid,null,,,,,,https://docs.microsoft.com/en-us/dynamics365-release-plan/2021wave2/sales/dynamics365-sales/show-sequence-details-grid,,,-,Oct 2021,This enhanced experience will allow sales enablement managers (SEMs) to easily manage the sequences and have a quick view of the status of attached entities.Feature details,The connected tab within the sequence is enhanced with more details that allow SEMs to work efficiently. Also you can see details of the status of each connected entity and get a view of which entities are connected through segments.NoteThis feature is available in Unified Interface only.
Worklist ownership enhancement,Worklist ownership enhancement,null,,,,,,https://docs.microsoft.com/en-us/dynamics365-release-plan/2021wave2/sales/dynamics365-sales/worklist-ownership-enhancement,,,-,Oct 2021,This functionality will enable each to user stay on top of his or her activities and would declutter the entity owner's worklist. For example if the opportunity is owned by a seller and the product expert has to prepare for the demo. Product experts will see the demo preparation activity and would be able to perform it from within the Sales Accelerator feature.Feature details,Worklists will be populated based on activity ownership instead of entity ownership. This will allow a seller who is responsible to finish the task to stay on top of the activity and would also declutter the entity owner's worklist.
Worklist and workspace improvement,Worklist and workspace improvement,null,,,,,,https://docs.microsoft.com/en-us/dynamics365-release-plan/2021wave2/sales/dynamics365-sales/worklist-workspace-improvement,,,-,Oct 2021,Boost sales productivity with an intelligent worklist. Get suggestive actions and stay on top of your to-do list. Focus on the right leads with the prioritized pipeline automated outreach recommendations and simple integrated engagement channels.This functionality will help organizations reduce lead qualification time. It will improve productivity and work satisfaction. This will also help sellers focus on the key task at hand while similar tasks can be bundled and completed in one click.Feature details,The worklist user interface is being enhanced to make it more usable and improve the seller's productivity. The filtering and sorting capabilities will also be enhanced.Going forward the visibility of items in the worklist will depend on ownership of the activity not just on ownership of the entity.See alsoPrioritize your sales pipeline by using the work list (docs)
Template sequences,Template sequences,null,,,,,,https://docs.microsoft.com/en-us/dynamics365-release-plan/2021wave2/sales/dynamics365-sales/template-sequences,,,-,Dec 2021,Template sequences can help customers to accelerate their sales accelerator implementation. These sequences are defined based on industry best practices and can help you define a consistent approach to connect with your customers.Key business benefits:Ready-to-use and preconfigured sequencesBased on industry best practices and proven business processesFaster and easier implementationProvide guidance on usage of various branching and other sequence capabilitiesFeature details,Multiple best practice templates would be made available as part of the product that can be easily copied and customized for your business needs. These template sequences will also showcase how sequence branching and other features can be utilized efficiently.
Smart sequence - LinkedIn integration,Smart sequence - LinkedIn integration,null,,,,,,https://docs.microsoft.com/en-us/dynamics365-release-plan/2021wave2/sales/dynamics365-sales/smart-sequence--linkedin-integration,,,-,Dec 2021,LinkedIn integration with sales accelerator will allow you to bring your most important social selling functions directly into your sequences. You can leverage LinkedIn's vast network and recommend the next best action to your sellers.Feature details,This feature allows users to perform the following LinkedIn actions within sales accelerator:InMailConnect requestIntroductionNoteThis feature is available in Unified Interface only.
Transport sequence between systems,Transport sequence between systems,null,,,,,,https://docs.microsoft.com/en-us/dynamics365-release-plan/2021wave2/sales/dynamics365-sales/transport-sequence-between-systems,,,-,Dec 2021,This functionality will ease the deployment of the sales accelerator solution. Administrators will be able to easily move finalized sequences to test environments.Feature details,This feature allows sequences to be transported between systems. For example if you create a sequence in a development environment you can move it to quality assurance (QA) and production environments.
Worklist card enhancement,Worklist card enhancement,null,,,,,,https://docs.microsoft.com/en-us/dynamics365-release-plan/2021wave2/sales/dynamics365-sales/worklist-card-enhancement,,,-,Dec 2021,The intent is to help sales development representatives (SDRs) business development representatives (BDRs) and account managers to perform their activities efficiently and maximize the business impact. To do so the system should help these users to quickly identify which customer to contact; having more information on the card will enable users to quickly make those decisions.Feature details,SDRs BDRs and account managers have different focuses and need ways to be able to quickly identify which customer to contact to maximize the business impact.Worklist cards will be enhanced to have more relevant information for each scenario. For example an opportunity will have information on title a contact will have information on role and an account will have information on open opportunity. This would allow users to make decisions by looking at a worklist card.
Improving leads quality with data hygiene,Improving leads quality with data hygiene,null,,,,,,https://docs.microsoft.com/en-us/dynamics365-release-plan/2021wave2/sales/dynamics365-sales/improving-leads-quality-data-hygiene,,,Nov 2021,Jan 2022,Sellers today often lose time engaging with the wrong leads struggling with a busy pipeline with irrelevant records and unable to find the customers that are more likely to close. Ensuring that only quality leads are being assigned to sellers with accurate data that enables personalized interactions will save sellers valuable time and allow them to close more business opportunities.Feature details,Automated process based on AI engine to achieve the following:Detection mechanism:Duplicates detection.False or invalid leads detection.Detection of leads-related records (including account or contact resolution).Detection of leads' additional available data.Enable automated actions upon detection of any of the above:Update close or delete a lead.Merge two (or more) leads.Notify user about detection (seller or admin).Configuration: User ability to choose and define a leads characteristics for detection and type of actions as a result.User-based decision or resolution interaction (advanced merge and advanced enrichment capability).
Lead routing,Lead routing,null,,,,,,https://docs.microsoft.com/en-us/dynamics365-release-plan/2021wave2/sales/dynamics365-sales/lead-routing,,,-,Jan 2022,Responding quickly to incoming leads can make or break a deal particularly in highly competitive markets. The more mature a business gets and the more complex the prospective customers needs are the more challenging it is to maintain that speedy response and personalized touch.Quickly growing businesses require more sophisticated automation to ensure operational efficiency proper distribution of leads among their sales team and to make sure no leads slip through the cracks. The functionality will provide the following business benefits:Maximize operational efficiencyImprove lead qualification timeImprove sellers productivityTimely lead assignmentImprove lead conversion ratioFeature details,This feature covers following functionalities:Define rules for automatic assignment. The following components are included:Segments: This is a group of leads that can be assigned to the rule.Lead attribute: Lead attributes that need to be considered should be maintained here.Seller attribute: The attributes and skills of the sellers that need to be evaluated for lead distribution should be mentioned in the rule.Distribution method: Lead can be distributed either through round robin or load balancing methods.Ability to define seller attributes and assign to the seller: Seller attributes can be specifically defined for lead routing.Create segment for the assignment rules.Maintain sales team and capacity. The user can maintain the sellers who would receive the leads. The capacity of the sellers can also be used which would be taken into consideration when distributing the leads.
Collaboration using Microsoft Teams,Collaboration using Microsoft Teams,Collaboration using Microsoft Teams,,,,,,https://docs.microsoft.com/en-us/dynamics365-release-plan/2021wave2/sales/dynamics365-sales/planned-features,,,,,,
Add activities or notes to a Dynamics 365 record from the context of a Microsoft Teams message,Add activities or notes to a Dynamics 365 record from the context of a Microsoft Teams message,null,,,,,,https://docs.microsoft.com/en-us/dynamics365-release-plan/2021wave2/sales/dynamics365-sales/add-activities-or-notes-dynamics-365-record-context-teams-message,,,Nov 2021,-,Quickly save decisions notes and other key sales events to Dynamics 365 without having to context switch out of Teams.Feature details,Add a note or task to a record's timeline from the context of a Microsoft Teams message in a chat or channel.Support customized forms and business rules specific to an organization.Ensure only those with required security permissions have write access.
